teilnehmer_id;zugehoerigkeit;alter;geschlecht;befindlichkeit_vorher;frage_a1;frage_a2;frage_a3;frage_a4;frage_a5;frage_a6;frage_a7;frage_b1;frage_b2;frage_b3;frage_b4;frage_b5;frage_b6;frage_b7;frage_b8;frage_b9;frage_c1;frage_c2;frage_c3;frage_c4;frage_c5;frage_c6;frage_c7;abschiedsbrief;zeichnung_datei;frage_d3;frage_e1;frage_e2;frage_e3;frage_e4_1;frage_e4_2;frage_e4_3
1;personal;60;w;Leicht positiv aktiviert;5;4;4;1;1;5;5;1;0;0;0;0;0;0;0;0;3;0;„platzsparend & übersichtlich";0;1;2;2;Farwell!;drawing_001.jpeg;;;;;;;
2;patienten;22;w;Leicht positiv aktiviert;2;4;4;5;1;5;5;0;0;0;0;0;0;1;0;0;2;1;„Kompakt, auf den ersten Blick Motiv erkennbar, Löcher verdrängt";0;0;0;2;Das Loch in dir, du Socke ähnelt dem Loch in meinem Herzen seit du fehlst :( I miss you;drawing_002.jpeg;;;;;;;
3;patienten;20;w;Leicht irritiert;3;3;3;4;1;1;1;0;0;0;1;1;1;1;1;0;2;1;„einfach & schnell";3;1;2;0;Paul war Schuld. Tut mir leid. Auf wiedersehen.;drawing_003.jpeg;;;;;;;
4;patienten;23;w;Leicht irritiert;5;4;4;4;4;5;5;0;0;0;1;0;1;0;1;0;3;1;„So gehen Sockenpaare nicht verloren und ich finde sie schneller.";3;2;2;2;Du warst immer eine treue Socke, aber Mama hat dich in der Waschtrommel vergessen.;drawing_004.jpeg;;;;;;;
5;patienten;19;w;Deutlich positiv aktiviert;4;3;1;2;2;5;5;0;0;0;1;0;0;0;0;0;2;1;„Kompressionsbasierte Bündelung sorgt für maximale Sockenharmonie im Kasten, sowie für eine besonders effiziente Organisation!";0;0;2;1;Meine Liebste Socke, vor drei Waschgängen bist du in die Trommel gestiegen und nie wieder aufgetaucht! Ich hoff du führst nun ein erfülltes Leben wo auch immer du sein magst!;drawing_005.jpeg;;;;;;;
6;Patienten;23;w;Deutlich positiv aktiviert;2;1;2;1;1;1;2;1;0;1;1;0;0;1;1;0;0;0;„In einem Sack voller Socken bleibt das Paar fest zusammen!";0;0;2;0;Danke für deine wärmende Begleitung. Ruhe in Frieden in den Tiefen der Waschmaschine!;drawing_006.jpeg;;;;;;;
